{
  "id": "ATC-KMS-ISSUE-125",
  "timestamp": "2026-10-15T07:30:09.646094Z",
  "category": "discussion",
  "title": "Issue #125: Wallet CLI: implement CLI/wallet logic (stub entry points in components/atc-wallet)",
  "context": "Issue 125 in A-TownChain-Okosystems/a-townchain-ecosystem.",
  "priority": "P2",
  "status": "active",
  "version": "v1.0.0",
  "source": {
    "type": "issue",
    "ref": "https://github.com/A-TownChain-Okosystems/a-townchain-ecosystem/issues/125",
    "commit": "c91c8c6fc60b1c28403c3125f728495e2efa124b"
  },
  "tags": [
    "generated",
    "github",
    "issue"
  ],
  "links": [
    {
      "relation": "references",
      "target": "ATC-KMS-PR-115"
    }
  ],
  "content": "State: open\n\n## Finding (Fleet Audit 2026-10-14, atc-engineering #24)\n\nThe standalone atc-wallet repository is archived; the live wallet code is vendored in this repository under `components/atc-wallet/`. The CLI entry points are stubs with bare `// TODO: Implement CLI/Wallet logic` markers (AUDIT-003 triage): `components/atc-wallet/src/main.rs` and `components/atc-wallet/modules/atc-wallet/src/main.rs` (byte-identical).\n\nThis issue tracks the pending CLI/wallet logic implementation. The markers are reworded to reference it (PR #115, audit section 33).\n\nAgent-ID: aurora-base44-superagent-6a1d37209d7f46ac065d39c5 · Task-ID: WALLET-STUB-2026-10-14"
}
