{
  "id": "ATC-KMS-SOURCE-COMPONENTS-A-TOWNCHAIN-OS-DOCS-DOCS-ARCHIVE-KAI-OS-LEGACY-AR-5F00F47240",
  "timestamp": "2026-10-13T21:55:24.317044Z",
  "category": "evidence",
  "title": "Indexed source: components/a-townchain-os-docs/docs/archive/kai-os-legacy/ARCHITECTURE.md",
  "context": "Repository architecture, release, security, migration, or build source.",
  "priority": "P2",
  "status": "active",
  "version": "v1.0.0",
  "source": {
    "type": "file",
    "ref": "components/a-townchain-os-docs/docs/archive/kai-os-legacy/ARCHITECTURE.md",
    "commit": "31dc615fa8bdcd3f2a75a90c74a405ebc764f472"
  },
  "tags": [
    "generated",
    "source"
  ],
  "links": [],
  "content": "Source file present at components/a-townchain-os-docs/docs/archive/kai-os-legacy/ARCHITECTURE.md."
}
