{
  "id": "ATC-KMS-SOURCE-DOCS-KNOWLEDGE-SYSTEM-RECORDS-GENERATED-ATC-KMS-SOURCE-COMPO-C0953C5939",
  "timestamp": "2026-10-11T21:35:32.359509Z",
  "category": "evidence",
  "title": "Indexed source: docs/knowledge-system/records/generated/ATC-KMS-SOURCE-COMPONENTS-A-TOWNCHAIN-COMPONENTS-EXPLORER-ARCHITECTURE-MD-2BB9566FE4.json",
  "context": "Repository architecture, release, security, migration, or build source.",
  "priority": "P2",
  "status": "active",
  "version": "v1.0.0",
  "source": {
    "type": "file",
    "ref": "docs/knowledge-system/records/generated/ATC-KMS-SOURCE-COMPONENTS-A-TOWNCHAIN-COMPONENTS-EXPLORER-ARCHITECTURE-MD-2BB9566FE4.json",
    "commit": "66928968018d9af428bc4d983467d1ff93d14a8c"
  },
  "tags": [
    "generated",
    "source"
  ],
  "links": [],
  "content": "Source file present at docs/knowledge-system/records/generated/ATC-KMS-SOURCE-COMPONENTS-A-TOWNCHAIN-COMPONENTS-EXPLORER-ARCHITECTURE-MD-2BB9566FE4.json."
}
