{
  "id": "ATC-KMS-COMMIT-B7283AF0B755",
  "timestamp": "2026-09-30T08:38:15.936659Z",
  "category": "change",
  "title": "Commit: feat(consensus): expose height-bound derived validator view",
  "context": "Git commit b7283af0b755159734b47b768b1412493a106f72 on A-TownChain-Okosystems/a-townchain-ecosystem.",
  "priority": "P2",
  "status": "active",
  "version": "v1.0.0",
  "source": {
    "type": "commit",
    "ref": "https://github.com/A-TownChain-Okosystems/a-townchain-ecosystem/commit/b7283af0b755159734b47b768b1412493a106f72",
    "commit": "30534d0e554e0b27a0aab956c2fe18e223ef47cd"
  },
  "tags": [
    "commit",
    "generated",
    "git"
  ],
  "links": [],
  "content": "feat(consensus): expose height-bound derived validator view"
}
