{
  "id": "ATC-KMS-COMMIT-84DA8DC15DA8",
  "timestamp": "2026-09-24T14:42:56.679568Z",
  "category": "change",
  "title": "Commit: style: apply rustfmt to L1 and wallet workspace",
  "context": "Git commit 84da8dc15da8ce6e1a0a9241a2866cf258451590 on A-TownChain-Okosystems/a-townchain-ecosystem.",
  "priority": "P2",
  "status": "active",
  "version": "v1.0.0",
  "source": {
    "type": "commit",
    "ref": "https://github.com/A-TownChain-Okosystems/a-townchain-ecosystem/commit/84da8dc15da8ce6e1a0a9241a2866cf258451590",
    "commit": "f8aca14c2a32ea3b36daa793dd7ae9b82ae0ac70"
  },
  "tags": [
    "commit",
    "generated",
    "git"
  ],
  "links": [],
  "content": "style: apply rustfmt to L1 and wallet workspace"
}
