{
  "id": "ATC-KMS-SOURCE-COMPONENTS-A-TOWNCHAIN-OS-DOCS-DOCS-ARCHIVE-MONOREPO-FULL-SR-CEFCB6289C",
  "timestamp": "2026-10-12T15:57:48.690199Z",
  "category": "evidence",
  "title": "Indexed source: components/a-townchain-os-docs/docs/archive/monorepo-full/src/modules/atc-security/Cargo.toml",
  "context": "Repository architecture, release, security, migration, or build source.",
  "priority": "P2",
  "status": "active",
  "version": "v1.0.0",
  "source": {
    "type": "file",
    "ref": "components/a-townchain-os-docs/docs/archive/monorepo-full/src/modules/atc-security/Cargo.toml",
    "commit": "4d5f514c40c8e38fd2596f1785884c86be48973b"
  },
  "tags": [
    "generated",
    "source"
  ],
  "links": [],
  "content": "Source file present at components/a-townchain-os-docs/docs/archive/monorepo-full/src/modules/atc-security/Cargo.toml."
}
