{
  "id": "ATC-KMS-COMMIT-66928968018D",
  "timestamp": "2026-10-12T20:22:25.936806Z",
  "category": "change",
  "title": "Commit: Merge pull request #117 from A-TownChain-Okosystems/docs/end-to-end-runtime-readiness",
  "context": "Git commit 66928968018d9af428bc4d983467d1ff93d14a8c on A-TownChain-Okosystems/a-townchain-ecosystem.",
  "priority": "P2",
  "status": "active",
  "version": "v1.0.0",
  "source": {
    "type": "commit",
    "ref": "https://github.com/A-TownChain-Okosystems/a-townchain-ecosystem/commit/66928968018d9af428bc4d983467d1ff93d14a8c",
    "commit": "60c04814508892166128aa0c2af32d734cb86bd7"
  },
  "tags": [
    "commit",
    "generated",
    "git"
  ],
  "links": [],
  "content": "Merge pull request #117 from A-TownChain-Okosystems/docs/end-to-end-runtime-readiness\n\ndocs: define end-to-end OS, kernel, AI and blockchain readiness gates"
}
