{
  "id": "ATC-KMS-SOURCE-COMPONENTS-A-TOWNCHAIN-OS-DOCS-DOCS-ARCHIVE-WIKI-ATC-ATCPKG--4FDF4CDE21",
  "timestamp": "2026-10-11T08:58:22.435525Z",
  "category": "evidence",
  "title": "Indexed source: components/a-townchain-os-docs/docs/archive/wiki/atc-atcpkg-wiki/ARCHITECTURE.md",
  "context": "Repository architecture, release, security, migration, or build source.",
  "priority": "P2",
  "status": "active",
  "version": "v1.0.0",
  "source": {
    "type": "file",
    "ref": "components/a-townchain-os-docs/docs/archive/wiki/atc-atcpkg-wiki/ARCHITECTURE.md",
    "commit": "4bc2c63868ee0b4df2456929d3a7d310bc7f4588"
  },
  "tags": [
    "generated",
    "source"
  ],
  "links": [],
  "content": "Source file present at components/a-townchain-os-docs/docs/archive/wiki/atc-atcpkg-wiki/ARCHITECTURE.md."
}
