{
  "id": "ATC-KMS-PR-6",
  "timestamp": "2026-10-04T08:29:34.182936Z",
  "category": "change",
  "title": "PR #6: fix: resolve remaining Python Ruff release gates",
  "context": "Pull request 6 in A-TownChain-Okosystems/a-townchain-ecosystem.",
  "priority": "P2",
  "status": "completed",
  "version": "v1.0.0",
  "source": {
    "type": "pr",
    "ref": "https://github.com/A-TownChain-Okosystems/a-townchain-ecosystem/pull/6",
    "commit": "f9f4eb781cfcd9171ba10c105cf5ea4443bc250b"
  },
  "tags": [
    "generated",
    "github",
    "pull-request"
  ],
  "links": [],
  "content": "State: closed\nMerged: True\nDraft: False\n\nFixes the concrete Python gate failures reported by Ecosystem Release Readiness run #10: Ruff import ordering in atc-contracts, atc-cli, and Aurora setup.py files, plus unused/broad exception handling in the ATCLang REPL. Changes are limited to the failing code paths; the readiness suite must pass before merge."
}
