{
  "id": "ATC-KMS-SOURCE-COMPONENTS-ATC-ZKP-DOCS-ZKP-ARCHITECTURE-MD-0687C00382",
  "timestamp": "2026-10-12T15:57:48.690199Z",
  "category": "evidence",
  "title": "Indexed source: components/atc-zkp/docs/ZKP_ARCHITECTURE.md",
  "context": "Repository architecture, release, security, migration, or build source.",
  "priority": "P2",
  "status": "active",
  "version": "v1.0.0",
  "source": {
    "type": "file",
    "ref": "components/atc-zkp/docs/ZKP_ARCHITECTURE.md",
    "commit": "4d5f514c40c8e38fd2596f1785884c86be48973b"
  },
  "tags": [
    "generated",
    "source"
  ],
  "links": [],
  "content": "Source file present at components/atc-zkp/docs/ZKP_ARCHITECTURE.md."
}
