{
  "id": "ATC-KMS-COMMIT-97AF9C1081AA",
  "timestamp": "2026-10-11T08:58:22.435525Z",
  "category": "change",
  "title": "Commit: Merge pull request #53 from A-TownChain-Okosystems/fix/algorithm-remove-fnv-consensus-path-20261002",
  "context": "Git commit 97af9c1081aae1a9fec09f41d12694a0fe2f9894 on A-TownChain-Okosystems/a-townchain-ecosystem.",
  "priority": "P2",
  "status": "active",
  "version": "v1.0.0",
  "source": {
    "type": "commit",
    "ref": "https://github.com/A-TownChain-Okosystems/a-townchain-ecosystem/commit/97af9c1081aae1a9fec09f41d12694a0fe2f9894",
    "commit": "4bc2c63868ee0b4df2456929d3a7d310bc7f4588"
  },
  "tags": [
    "commit",
    "generated",
    "git"
  ],
  "links": [],
  "content": "Merge pull request #53 from A-TownChain-Okosystems/fix/algorithm-remove-fnv-consensus-path-20261002\n\nfix(consensus): remove FNV from PoH and proposer selection"
}
