{
  "id": "ATC-KMS-SOURCE-DOCS-KNOWLEDGE-SYSTEM-RECORDS-GENERATED-ATC-KMS-SOURCE-COMPO-D188A3A930",
  "timestamp": "2026-10-12T20:22:25.936806Z",
  "category": "evidence",
  "title": "Indexed source: docs/knowledge-system/records/generated/ATC-KMS-SOURCE-COMPONENTS-GLOBUS-OS-DOCS-SYSTEM-ARCHITECTURE-MD-BC64C29091.json",
  "context": "Repository architecture, release, security, migration, or build source.",
  "priority": "P2",
  "status": "active",
  "version": "v1.0.0",
  "source": {
    "type": "file",
    "ref": "docs/knowledge-system/records/generated/ATC-KMS-SOURCE-COMPONENTS-GLOBUS-OS-DOCS-SYSTEM-ARCHITECTURE-MD-BC64C29091.json",
    "commit": "60c04814508892166128aa0c2af32d734cb86bd7"
  },
  "tags": [
    "generated",
    "source"
  ],
  "links": [],
  "content": "Source file present at docs/knowledge-system/records/generated/ATC-KMS-SOURCE-COMPONENTS-GLOBUS-OS-DOCS-SYSTEM-ARCHITECTURE-MD-BC64C29091.json."
}
