{
  "id": "ATC-KMS-SOURCE-COMPONENTS-GLOBUS-OS-SYSTEM-PACKAGE-CARGO-TOML-62CFC8F045",
  "timestamp": "2026-10-11T08:58:22.435525Z",
  "category": "evidence",
  "title": "Indexed source: components/globus-os/system/package/Cargo.toml",
  "context": "Repository architecture, release, security, migration, or build source.",
  "priority": "P2",
  "status": "active",
  "version": "v1.0.0",
  "source": {
    "type": "file",
    "ref": "components/globus-os/system/package/Cargo.toml",
    "commit": "4bc2c63868ee0b4df2456929d3a7d310bc7f4588"
  },
  "tags": [
    "generated",
    "source"
  ],
  "links": [],
  "content": "Source file present at components/globus-os/system/package/Cargo.toml."
}
