{
  "id": "ATC-KMS-COMMIT-1DCFDFCEF9D2",
  "timestamp": "2026-10-13T21:55:24.317044Z",
  "category": "change",
  "title": "Commit: docs: add machine-readable runtime readiness gates",
  "context": "Git commit 1dcfdfcef9d29324c69bf4c24cc7c260aeffa5ef on A-TownChain-Okosystems/a-townchain-ecosystem.",
  "priority": "P2",
  "status": "active",
  "version": "v1.0.0",
  "source": {
    "type": "commit",
    "ref": "https://github.com/A-TownChain-Okosystems/a-townchain-ecosystem/commit/1dcfdfcef9d29324c69bf4c24cc7c260aeffa5ef",
    "commit": "31dc615fa8bdcd3f2a75a90c74a405ebc764f472"
  },
  "tags": [
    "commit",
    "generated",
    "git"
  ],
  "links": [],
  "content": "docs: add machine-readable runtime readiness gates"
}
