{
  "id": "ATC-KMS-SOURCE-COMPONENTS-ATC-LAUNCHPAD-ARCHITECTURE-MD-B395C9642B",
  "timestamp": "2026-10-13T09:28:49.133059Z",
  "category": "evidence",
  "title": "Indexed source: components/atc-launchpad/ARCHITECTURE.md",
  "context": "Repository architecture, release, security, migration, or build source.",
  "priority": "P2",
  "status": "active",
  "version": "v1.0.0",
  "source": {
    "type": "file",
    "ref": "components/atc-launchpad/ARCHITECTURE.md",
    "commit": "2b6b885221416673333a49fb9327374d4deebf8c"
  },
  "tags": [
    "generated",
    "source"
  ],
  "links": [],
  "content": "Source file present at components/atc-launchpad/ARCHITECTURE.md."
}
