{
  "id": "ATC-KMS-COMPONENT-ATC-SDK-48E4BE24F5",
  "timestamp": "2026-10-13T21:55:24.317044Z",
  "category": "module",
  "title": "Component: atc-sdk",
  "context": "Component subtree indexed from A-TownChain-Okosystems/a-townchain-ecosystem.",
  "priority": "P2",
  "status": "active",
  "version": "v1.0.0",
  "source": {
    "type": "file",
    "ref": "components/atc-sdk",
    "commit": "31dc615fa8bdcd3f2a75a90c74a405ebc764f472"
  },
  "tags": [
    "atc-sdk",
    "component",
    "generated"
  ],
  "links": [
    {
      "relation": "part-of",
      "target": "ATC-KMS-REPOSITORY-STRUCTURE"
    }
  ],
  "content": "Files: 113\n\nManifests: components/atc-sdk/Cargo.toml, components/atc-sdk/modules/atc-cli/Cargo.toml, components/atc-sdk/modules/atc-sdk/package.json, components/atc-sdk/modules/atc-sdk/rust/Cargo.toml, components/atc-sdk/modules/atc-sdk/typescript/package.json, components/atc-sdk/package.json, components/atc-sdk/typescript/package.json"
}
