{
  "id": "ATC-KMS-PR-37",
  "timestamp": "2026-10-11T21:35:32.359509Z",
  "category": "change",
  "title": "PR #37: fix(l1): connect and verify runtime network handshake",
  "context": "Pull request 37 in A-TownChain-Okosystems/a-townchain-ecosystem.",
  "priority": "P2",
  "status": "completed",
  "version": "v1.0.0",
  "source": {
    "type": "pr",
    "ref": "https://github.com/A-TownChain-Okosystems/a-townchain-ecosystem/pull/37",
    "commit": "66928968018d9af428bc4d983467d1ff93d14a8c"
  },
  "tags": [
    "generated",
    "github",
    "pull-request"
  ],
  "links": [],
  "content": "State: closed\nMerged: True\nDraft: False\n\n## Summary\n- correct the TCP peer handshake so the accepting node reports its own height/tip instead of echoing peer values\n- strengthen the multi-process L1 network regression test\n- document the canonical wallet/SDK → mempool → block → state → reward → vote → finality → persistence → restart path\n\n## Verification\nGitHub Actions must be green before any production-readiness claim."
}
