{
  "id": "ATC-KMS-COMMIT-74074F6B4A4A",
  "timestamp": "2026-10-12T09:17:58.712693Z",
  "category": "change",
  "title": "Commit: chore(evidence): bound_commit + test_run aktualisiert (SCR-0086) [skip ci]",
  "context": "Git commit 74074f6b4a4ae992b14f5af79e1faa8a96ef3b00 on A-TownChain-Okosystems/a-townchain-ecosystem.",
  "priority": "P2",
  "status": "active",
  "version": "v1.0.0",
  "source": {
    "type": "commit",
    "ref": "https://github.com/A-TownChain-Okosystems/a-townchain-ecosystem/commit/74074f6b4a4ae992b14f5af79e1faa8a96ef3b00",
    "commit": "a4264a2a03ff092e5e90cb5f971e769bb5704eec"
  },
  "tags": [
    "commit",
    "generated",
    "git"
  ],
  "links": [],
  "content": "chore(evidence): bound_commit + test_run aktualisiert (SCR-0086) [skip ci]"
}
