{
  "id": "ATC-KMS-COMMIT-9BF05A909F30",
  "timestamp": "2026-10-11T21:35:32.359509Z",
  "category": "change",
  "title": "Commit: fix(lexer): skip line comments before tokenizing",
  "context": "Git commit 9bf05a909f30b901232daeda3b10329917dff256 on A-TownChain-Okosystems/a-townchain-ecosystem.",
  "priority": "P2",
  "status": "active",
  "version": "v1.0.0",
  "source": {
    "type": "commit",
    "ref": "https://github.com/A-TownChain-Okosystems/a-townchain-ecosystem/commit/9bf05a909f30b901232daeda3b10329917dff256",
    "commit": "66928968018d9af428bc4d983467d1ff93d14a8c"
  },
  "tags": [
    "commit",
    "generated",
    "git"
  ],
  "links": [],
  "content": "fix(lexer): skip line comments before tokenizing"
}
