{
  "id": "ATC-KMS-COMMIT-5B777683D60C",
  "timestamp": "2026-10-11T21:35:32.359509Z",
  "category": "change",
  "title": "Commit: Merge pull request #27 from A-TownChain-Okosystems/feat/graphics-ai-core",
  "context": "Git commit 5b777683d60c30edca1c87a511d235a7f9eed25a on A-TownChain-Okosystems/a-townchain-ecosystem.",
  "priority": "P2",
  "status": "active",
  "version": "v1.0.0",
  "source": {
    "type": "commit",
    "ref": "https://github.com/A-TownChain-Okosystems/a-townchain-ecosystem/commit/5b777683d60c30edca1c87a511d235a7f9eed25a",
    "commit": "66928968018d9af428bc4d983467d1ff93d14a8c"
  },
  "tags": [
    "commit",
    "generated",
    "git"
  ],
  "links": [],
  "content": "Merge pull request #27 from A-TownChain-Okosystems/feat/graphics-ai-core\n\nfeat(graphics): implement deterministic Graphics AI planner"
}
