{
  "id": "ATC-KMS-SOURCE-COMPONENTS-A-TOWNCHAIN-OS-DOCS-MODULE-DOCS-ATCNET-CHANGELOG--73D6C1A69F",
  "timestamp": "2026-10-12T20:22:25.936806Z",
  "category": "evidence",
  "title": "Indexed source: components/a-townchain-os-docs/module-docs/atcnet/CHANGELOG.md",
  "context": "Repository architecture, release, security, migration, or build source.",
  "priority": "P2",
  "status": "active",
  "version": "v1.0.0",
  "source": {
    "type": "file",
    "ref": "components/a-townchain-os-docs/module-docs/atcnet/CHANGELOG.md",
    "commit": "60c04814508892166128aa0c2af32d734cb86bd7"
  },
  "tags": [
    "generated",
    "source"
  ],
  "links": [],
  "content": "Source file present at components/a-townchain-os-docs/module-docs/atcnet/CHANGELOG.md."
}
